{
  "schema_version": "0.1",
  "emitted_at": "2026-05-03T00:00:00Z",
  "scp_version": "1.2.0",
  "repo": "jrnb2024/standards-control-plane",
  "ref": "main",
  "commit": "0000000000000000000000000000000000000001",
  "verdict": "allow",
  "rule_counts": {},
  "waivers_aggregate": {
    "active_count": 0,
    "by_rule_id": {},
    "expiring_within_30d": 0
  },
  "rule_config_aggregate": {
    "disabled_rules": [],
    "expiring_within_30d": 0
  }
}
